<?xml version="1.0" encoding="UTF-8"?>
<!-- ejercicio-ii-2b.xml grupo 05 -->

<?xml-stylesheet type="text/css" href="../../css/estilo-ii-1b.css" ?>

<!DOCTYPE fichero SYSTEM "../dtd_externa/dtd/ejercicio2b.dtd">
<fichero nombre="Ficha laboral">
 <ficha id = "1">
  <nombres sexo="femenino" edad="22" estado="activo">Angelina Fernanda</nombres>
  <apellidos>Fernandez Hernandez</apellidos>
  <direccion id="1">
  <pais>El Salvador</pais>
  <ciudad>San Salvador</ciudad>
  <calle>Calle Ppal Col Escalon</calle>
  </direccion>
  <DUI>060605-987</DUI>
  <estadoCivil>Soltera</estadoCivil>
  <correo empresarial="si">FG45889@ues.edu.sv</correo>
  <telefono tipo="fijo">22592209</telefono>
  <empresa tipo="publica">ANDA</empresa>
 </ficha>

 <ficha id = "2">
  <nombres sexo="femenino" edad="22" estado="activo">karen Camila</nombres>
  <apellidos>Perez Hernandez</apellidos>
  <direccion id="1">
  <pais>El Salvador</pais>
  <ciudad>San Salvador</ciudad>
  <calle>Calle Ppal Col Medica</calle>
  </direccion>
  <DUI>760805-987</DUI>
  <estadoCivil>Casada</estadoCivil>
  <correo empresarial="no">PH45889@gmail.com</correo>
  <telefono tipo="movil">70803109</telefono>
  <empresa tipo="privada">ANEP</empresa>
 </ficha>
</fichero>